A Survey on Non-Orthogonal Multiple Access for 5G Networks: Research Challenges and Future Trends.,https://doi.org/10.1109/JSAC.2017.2725519,2017,A,IEEE Journal of Selected Areas in Communications (JSAC)
On the Design of Secure Non-Orthogonal Multiple Access Systems.,https://doi.org/10.1109/JSAC.2017.2725698,2017,A,IEEE Journal of Selected Areas in Communications (JSAC)
Exploiting Multiple-Antenna Techniques for Non-Orthogonal Multiple Access.,https://doi.org/10.1109/JSAC.2017.2724420,2017,A,IEEE Journal of Selected Areas in Communications (JSAC)
Modeling and Analysis of Non-Orthogonal MBMS Transmission in Heterogeneous Networks.,https://doi.org/10.1109/JSAC.2017.2724458,2017,A,IEEE Journal of Selected Areas in Communications (JSAC)
On the Fundamental Limits of Random Non-Orthogonal Multiple Access in Cellular Massive IoT.,https://doi.org/10.1109/JSAC.2017.2724442,2017,A,IEEE Journal of Selected Areas in Communications (JSAC)
Non-Orthogonal Multiple Access Based Integrated Terrestrial-Satellite Networks.,https://doi.org/10.1109/JSAC.2017.2724478,2017,A,IEEE Journal of Selected Areas in Communications (JSAC)
A New View of Multi-User Hybrid Massive MIMO: Non-Orthogonal Angle Division Multiple Access.,https://doi.org/10.1109/JSAC.2017.2725682,2017,A,IEEE Journal of Selected Areas in Communications (JSAC)
NOMA in Downlink SDMA With Limited Feedback: Performance Analysis and Optimization.,https://doi.org/10.1109/JSAC.2017.2725107,2017,A,IEEE Journal of Selected Areas in Communications (JSAC)
Grouping and Cooperating Among Access Points in User-Centric Ultra-Dense Networks With Non-Orthogonal Multiple Access.,https://doi.org/10.1109/JSAC.2017.2724680,2017,A,IEEE Journal of Selected Areas in Communications (JSAC)
Practical Power-Balanced Non-Orthogonal Multiple Access.,https://doi.org/10.1109/JSAC.2017.2727198,2017,A,IEEE Journal of Selected Areas in Communications (JSAC)
NOMA-Based Multi-Pair Two-Way Relay Networks With Rate Splitting and Group Decoding.,https://doi.org/10.1109/JSAC.2017.2726008,2017,A,IEEE Journal of Selected Areas in Communications (JSAC)
Dynamic Cell Association for Non-Orthogonal Multiple-Access V2S Networks.,https://doi.org/10.1109/JSAC.2017.2725178,2017,A,IEEE Journal of Selected Areas in Communications (JSAC)
Optimal Power Allocation Scheme for Non-Orthogonal Multiple Access With α-Fairness.,https://doi.org/10.1109/JSAC.2017.2729780,2017,A,IEEE Journal of Selected Areas in Communications (JSAC)
Spectrum and Energy-Efficient Beamspace MIMO-NOMA for Millimeter-Wave Communications Using Lens Antenna Array.,https://doi.org/10.1109/JSAC.2017.2725878,2017,A,IEEE Journal of Selected Areas in Communications (JSAC)
Non-Orthogonal Multiple Access for High-Reliable and Low-Latency V2X Communications in 5G Systems.,https://doi.org/10.1109/JSAC.2017.2726018,2017,A,IEEE Journal of Selected Areas in Communications (JSAC)
Performance Analysis and Optimization in Downlink NOMA Systems With Cooperative Full-Duplex Relaying.,https://doi.org/10.1109/JSAC.2017.2724678,2017,A,IEEE Journal of Selected Areas in Communications (JSAC)
Capacity Comparison Between MIMO-NOMA and MIMO-OMA With Multiple Users in a Cluster.,https://doi.org/10.1109/JSAC.2017.2725879,2017,A,IEEE Journal of Selected Areas in Communications (JSAC)
Guest Editorial Emerging Technologies in Software- Driven Communication.,https://doi.org/10.1109/JSAC.2017.2760479,2017,A,IEEE Journal of Selected Areas in Communications (JSAC)
Autonomic Communications in Software-Driven Networks.,https://doi.org/10.1109/JSAC.2017.2760354,2017,A,IEEE Journal of Selected Areas in Communications (JSAC)
Control Link Load Balancing and Low Delay Route Deployment for Software Defined Networks.,https://doi.org/10.1109/JSAC.2017.2760187,2017,A,IEEE Journal of Selected Areas in Communications (JSAC)
Contract Design for Traffic Offloading and Resource Allocation in Heterogeneous Ultra-Dense Networks.,https://doi.org/10.1109/JSAC.2017.2760459,2017,A,IEEE Journal of Selected Areas in Communications (JSAC)
NFV and SDN - Key Technology Enablers for 5G Networks.,https://doi.org/10.1109/JSAC.2017.2760418,2017,A,IEEE Journal of Selected Areas in Communications (JSAC)
Distributed Service Function Chaining.,https://doi.org/10.1109/JSAC.2017.2760178,2017,A,IEEE Journal of Selected Areas in Communications (JSAC)
HYPER: A Hybrid High-Performance Framework for Network Function Virtualization.,https://doi.org/10.1109/JSAC.2017.2760438,2017,A,IEEE Journal of Selected Areas in Communications (JSAC)
"Dynamic Scaling of Virtualized, Distributed Service Chains: A Case Study of IMS.",https://doi.org/10.1109/JSAC.2017.2760188,2017,A,IEEE Journal of Selected Areas in Communications (JSAC)
Network Slicing for Service-Oriented Networks Under Resource Constraints.,https://doi.org/10.1109/JSAC.2017.2760147,2017,A,IEEE Journal of Selected Areas in Communications (JSAC)
QoS-Aware and Reliable Traffic Steering for Service Function Chaining in Mobile Networks.,https://doi.org/10.1109/JSAC.2017.2760158,2017,A,IEEE Journal of Selected Areas in Communications (JSAC)
Joint Optimization of Service Function Placement and Flow Distribution for Service Function Chaining.,https://doi.org/10.1109/JSAC.2017.2760162,2017,A,IEEE Journal of Selected Areas in Communications (JSAC)
Scheduling Congestion- and Loop-Free Network Update in Timed SDNs.,https://doi.org/10.1109/JSAC.2017.2760146,2017,A,IEEE Journal of Selected Areas in Communications (JSAC)
ENDEAVOUR: A Scalable SDN Architecture For Real-World IXPs.,https://doi.org/10.1109/JSAC.2017.2760398,2017,A,IEEE Journal of Selected Areas in Communications (JSAC)
Stemflow: Software-Defined Inter-Datacenter Overlay as a Service.,https://doi.org/10.1109/JSAC.2017.2760159,2017,A,IEEE Journal of Selected Areas in Communications (JSAC)
Re-Designing Dynamic Content Delivery in the Light of a Virtualized Infrastructure.,https://doi.org/10.1109/JSAC.2017.2760185,2017,A,IEEE Journal of Selected Areas in Communications (JSAC)
The Extended Cloud: Review and Analysis of Mobile Edge Computing and Fog From a Security and Resilience Perspective.,https://doi.org/10.1109/JSAC.2017.2760478,2017,A,IEEE Journal of Selected Areas in Communications (JSAC)
Cooperative Edge Caching in Software-Defined Hyper-Cellular Networks.,https://doi.org/10.1109/JSAC.2017.2760184,2017,A,IEEE Journal of Selected Areas in Communications (JSAC)
Optimal Schedule of Mobile Edge Computing for Internet of Things Using Partial Information.,https://doi.org/10.1109/JSAC.2017.2760186,2017,A,IEEE Journal of Selected Areas in Communications (JSAC)
A Distributed Locality-Sensitive Hashing-Based Approach for Cloud Service Recommendation From Multi-Source Data.,https://doi.org/10.1109/JSAC.2017.2760458,2017,A,IEEE Journal of Selected Areas in Communications (JSAC)
Location Privacy in Mobile Edge Clouds: A Chaff-Based Approach.,https://doi.org/10.1109/JSAC.2017.2760179,2017,A,IEEE Journal of Selected Areas in Communications (JSAC)
EMM: Energy-Aware Mobility Management for Mobile Edge Computing in Ultra Dense Networks.,https://doi.org/10.1109/JSAC.2017.2760160,2017,A,IEEE Journal of Selected Areas in Communications (JSAC)
Performance Analysis of NOMA-SM in Vehicle-to-Vehicle Massive MIMO Channels.,https://doi.org/10.1109/JSAC.2017.2726006,2017,A,IEEE Journal of Selected Areas in Communications (JSAC)
Non-Orthogonal Multiple Access in Large-Scale Heterogeneous Networks.,https://doi.org/10.1109/JSAC.2017.2726718,2017,A,IEEE Journal of Selected Areas in Communications (JSAC)
Precoder Design for Signal Superposition in MIMO-NOMA Multicell Networks.,https://doi.org/10.1109/JSAC.2017.2726007,2017,A,IEEE Journal of Selected Areas in Communications (JSAC)
On Orthogonal and Superimposed Pilot Schemes in Massive MIMO NOMA Systems.,https://doi.org/10.1109/JSAC.2017.2726019,2017,A,IEEE Journal of Selected Areas in Communications (JSAC)
Low Complexity Beamforming and User Selection Schemes for 5G MIMO-NOMA Systems.,https://doi.org/10.1109/JSAC.2017.2727229,2017,A,IEEE Journal of Selected Areas in Communications (JSAC)
A Non-Orthogonal Multiple Access-Based Multicast Scheme in Wireless Content Caching Networks.,https://doi.org/10.1109/JSAC.2017.2726698,2017,A,IEEE Journal of Selected Areas in Communications (JSAC)
NOMA-Based Random Access With Multichannel ALOHA.,https://doi.org/10.1109/JSAC.2017.2766778,2017,A,IEEE Journal of Selected Areas in Communications (JSAC)
On Optimal Power Allocation for Downlink Non-Orthogonal Multiple Access Systems.,https://doi.org/10.1109/JSAC.2017.2725618,2017,A,IEEE Journal of Selected Areas in Communications (JSAC)
Resource Allocation in Energy-Cooperation Enabled Two-Tier NOMA HetNets Toward Green 5G.,https://doi.org/10.1109/JSAC.2017.2726398,2017,A,IEEE Journal of Selected Areas in Communications (JSAC)
Downlink and Uplink Non-Orthogonal Multiple Access in a Dense Wireless Network.,https://doi.org/10.1109/JSAC.2017.2724646,2017,A,IEEE Journal of Selected Areas in Communications (JSAC)
Highly Efficient 3-D Resource Allocation Techniques in 5G for NOMA-Enabled Massive MIMO and Relaying Systems.,https://doi.org/10.1109/JSAC.2017.2726378,2017,A,IEEE Journal of Selected Areas in Communications (JSAC)
Joint Rate Control and Power Allocation for Non-Orthogonal Multiple Access Systems.,https://doi.org/10.1109/JSAC.2017.2726357,2017,A,IEEE Journal of Selected Areas in Communications (JSAC)
Efficient Multi-User Detection for Uplink Grant-Free NOMA: Prior-Information Aided Adaptive Compressive Sensing Perspective.,https://doi.org/10.1109/JSAC.2017.2726279,2017,A,IEEE Journal of Selected Areas in Communications (JSAC)
On Non-Orthogonal Multiple Access With Finite-Alphabet Inputs in Z-Channels.,https://doi.org/10.1109/JSAC.2017.2724619,2017,A,IEEE Journal of Selected Areas in Communications (JSAC)
Achievable Rate Region of Non-Orthogonal Multiple Access Systems With Wireless Powered Decoder.,https://doi.org/10.1109/JSAC.2017.2726242,2017,A,IEEE Journal of Selected Areas in Communications (JSAC)
Resource Optimization and Power Allocation in In-Band Full Duplex-Enabled Non-Orthogonal Multiple Access Networks.,https://doi.org/10.1109/JSAC.2017.2726218,2017,A,IEEE Journal of Selected Areas in Communications (JSAC)
Joint User Scheduling and Power Allocation Optimization for Energy-Efficient NOMA Systems With Imperfect CSI.,https://doi.org/10.1109/JSAC.2017.2777672,2017,A,IEEE Journal of Selected Areas in Communications (JSAC)
"Guest Editorial Localisation, Communication and Networking With VLC.",https://doi.org/10.1109/JSAC.2017.2780979,2018,A,IEEE Journal of Selected Areas in Communications (JSAC)
Three-Dimensional VLC Positioning Based on Angle Difference of Arrival With Arbitrary Tilting Angle of Receiver.,https://doi.org/10.1109/JSAC.2017.2774435,2018,A,IEEE Journal of Selected Areas in Communications (JSAC)
A 3-D Positioning Algorithm for AOA-Based VLP With an Aperture-Based Receiver.,https://doi.org/10.1109/JSAC.2017.2774478,2018,A,IEEE Journal of Selected Areas in Communications (JSAC)
Coding and Bounds for Channel Estimation in Visible Light Communications and Positioning.,https://doi.org/10.1109/JSAC.2017.2774718,2018,A,IEEE Journal of Selected Areas in Communications (JSAC)
Hybrid PWM/DPAM Dimming Control for Digital Color Shift Keying Using RGB-LED Array.,https://doi.org/10.1109/JSAC.2017.2774738,2018,A,IEEE Journal of Selected Areas in Communications (JSAC)
Robust and Low-Complexity Timing Synchronization for DCO-OFDM LiFi Systems.,https://doi.org/10.1109/JSAC.2017.2774419,2018,A,IEEE Journal of Selected Areas in Communications (JSAC)
Transceiver Design for MIMO VLC Systems With Integer-Forcing Receivers.,https://doi.org/10.1109/JSAC.2017.2774458,2018,A,IEEE Journal of Selected Areas in Communications (JSAC)
Block Precoding for Peak-Limited MISO Broadcast VLC: Constellation-Optimal Structure and Addition-Unique Designs.,https://doi.org/10.1109/JSAC.2017.2774480,2018,A,IEEE Journal of Selected Areas in Communications (JSAC)
Aligning the Light Without Channel State Information for Visible Light Communications.,https://doi.org/10.1109/JSAC.2017.2774518,2018,A,IEEE Journal of Selected Areas in Communications (JSAC)
Biased Multi-LED Beamforming for Multicarrier Visible Light Communications.,https://doi.org/10.1109/JSAC.2017.2774539,2018,A,IEEE Journal of Selected Areas in Communications (JSAC)
"Multi-Element VLC Networks: LED Assignment, Power Control, and Optimum Combining.",https://doi.org/10.1109/JSAC.2017.2774378,2018,A,IEEE Journal of Selected Areas in Communications (JSAC)
Joint User Association and Power Allocation for Cell-Free Visible Light Communication Networks.,https://doi.org/10.1109/JSAC.2017.2774400,2018,A,IEEE Journal of Selected Areas in Communications (JSAC)
"In Light and In Darkness, In Motion and In Stillness: A Reliable and Adaptive Receiver for the Internet of Lights.",https://doi.org/10.1109/JSAC.2017.2774422,2018,A,IEEE Journal of Selected Areas in Communications (JSAC)
Physical-Layer Security in Multiuser Visible Light Communication Networks.,https://doi.org/10.1109/JSAC.2017.2774429,2018,A,IEEE Journal of Selected Areas in Communications (JSAC)
Visible-Light Multi-Gb/s Transmission Based on Resonant Cavity LED With Optical Energy Feed.,https://doi.org/10.1109/JSAC.2017.2774578,2018,A,IEEE Journal of Selected Areas in Communications (JSAC)
Optical Wireless MIMO Experiments in an Industrial Environment.,https://doi.org/10.1109/JSAC.2017.2774618,2018,A,IEEE Journal of Selected Areas in Communications (JSAC)
Full-Fledged 10Base-T Ethernet Underwater Optical Wireless Communication System.,https://doi.org/10.1109/JSAC.2017.2774702,2018,A,IEEE Journal of Selected Areas in Communications (JSAC)
A Fixed-Scale Pixelated MIMO Visible Light Communication System.,https://doi.org/10.1109/JSAC.2017.2774706,2018,A,IEEE Journal of Selected Areas in Communications (JSAC)
Guest Editorial Advances in Satellite Communications - Part 1.,https://doi.org/10.1109/JSAC.2018.2813579,2018,A,IEEE Journal of Selected Areas in Communications (JSAC)
Joint Placement of Controllers and Gateways in SDN-Enabled 5G-Satellite Integrated Network.,https://doi.org/10.1109/JSAC.2018.2804019,2018,A,IEEE Journal of Selected Areas in Communications (JSAC)
WiLiTV: Reducing Live Satellite TV Costs Using Wireless Relays.,https://doi.org/10.1109/JSAC.2018.2804040,2018,A,IEEE Journal of Selected Areas in Communications (JSAC)
A Distributed Trust Management Scheme for Data Forwarding in Satellite DTN Emergency Communications.,https://doi.org/10.1109/JSAC.2018.2804098,2018,A,IEEE Journal of Selected Areas in Communications (JSAC)
FRUDP: A Reliable Data Transport Protocol for Aeronautical Ad Hoc Networks.,https://doi.org/10.1109/JSAC.2018.2804099,2018,A,IEEE Journal of Selected Areas in Communications (JSAC)
Multi-Resource Coordinate Scheduling for Earth Observation in Space Information Networks.,https://doi.org/10.1109/JSAC.2018.2804045,2018,A,IEEE Journal of Selected Areas in Communications (JSAC)
Random Access Preamble Design and Detection for Mobile Satellite Communication Systems.,https://doi.org/10.1109/JSAC.2018.2804138,2018,A,IEEE Journal of Selected Areas in Communications (JSAC)
On the Modeling and Performance Assessment of Random Access With SIC.,https://doi.org/10.1109/JSAC.2018.2804175,2018,A,IEEE Journal of Selected Areas in Communications (JSAC)
Achievable Rate Maximization for Cognitive Hybrid Satellite-Terrestrial Networks With AF-Relays.,https://doi.org/10.1109/JSAC.2018.2804018,2018,A,IEEE Journal of Selected Areas in Communications (JSAC)
Fast and Accurate Estimation of Angle-of-Arrival for Satellite-Borne Wideband Communication System.,https://doi.org/10.1109/JSAC.2018.2804047,2018,A,IEEE Journal of Selected Areas in Communications (JSAC)
Next Generation High-Rate Telemetry.,https://doi.org/10.1109/JSAC.2018.2804078,2018,A,IEEE Journal of Selected Areas in Communications (JSAC)
Design of Digital Satellite Processors: From Communications Link Performance to Hardware Complexity.,https://doi.org/10.1109/JSAC.2018.2804198,2018,A,IEEE Journal of Selected Areas in Communications (JSAC)
A GNSS/5G Integrated Positioning Methodology in D2D Communication Networks.,https://doi.org/10.1109/JSAC.2018.2804223,2018,A,IEEE Journal of Selected Areas in Communications (JSAC)
Beam Tracking for UAV Mounted SatCom on-the-Move With Massive Antenna Array.,https://doi.org/10.1109/JSAC.2018.2804239,2018,A,IEEE Journal of Selected Areas in Communications (JSAC)
Guest Editorial First Edition of Series On Network Softwarization and Enablers.,https://doi.org/10.1109/JSAC.2018.2827538,2018,A,IEEE Journal of Selected Areas in Communications (JSAC)
Cutting Long-Tail Latency of Routing Response in Software Defined Networks.,https://doi.org/10.1109/JSAC.2018.2815358,2018,A,IEEE Journal of Selected Areas in Communications (JSAC)
Joint Virtual Switch Deployment and Routing for Load Balancing in SDNs.,https://doi.org/10.1109/JSAC.2018.2815379,2018,A,IEEE Journal of Selected Areas in Communications (JSAC)
Efficient and Consistent Flow Update for Software Defined Networks.,https://doi.org/10.1109/JSAC.2018.2815458,2018,A,IEEE Journal of Selected Areas in Communications (JSAC)
Configuring a Software Router by the Erlang-k-Based Packet Latency Prediction.,https://doi.org/10.1109/JSAC.2018.2815420,2018,A,IEEE Journal of Selected Areas in Communications (JSAC)
"SoftBox: A Customizable, Low-Latency, and Scalable 5G Core Network Architecture.",https://doi.org/10.1109/JSAC.2018.2815429,2018,A,IEEE Journal of Selected Areas in Communications (JSAC)
Cloud-RAN Modeling Based on Parallel Processing.,https://doi.org/10.1109/JSAC.2018.2815378,2018,A,IEEE Journal of Selected Areas in Communications (JSAC)
Coalitional Game for the Creation of Efficient Virtual Core Network Slices in 5G Mobile Systems.,https://doi.org/10.1109/JSAC.2018.2815398,2018,A,IEEE Journal of Selected Areas in Communications (JSAC)
Achieving End-to-End Reliability of Mission-Critical Traffic in Softwarized 5G Networks.,https://doi.org/10.1109/JSAC.2018.2815419,2018,A,IEEE Journal of Selected Areas in Communications (JSAC)
Virtual Network Survivability Through Joint Spare Capacity Allocation and Embedding.,https://doi.org/10.1109/JSAC.2018.2815430,2018,A,IEEE Journal of Selected Areas in Communications (JSAC)
Conformal Mapping for Optimal Network Slice Planning Based on Canonical Domains.,https://doi.org/10.1109/JSAC.2018.2815436,2018,A,IEEE Journal of Selected Areas in Communications (JSAC)
A Scalable Approach for Service Chain Mapping With Multiple SC Instances in a Wide-Area Network.,https://doi.org/10.1109/JSAC.2018.2815298,2018,A,IEEE Journal of Selected Areas in Communications (JSAC)
"vSPACE: VNF Simultaneous Placement, Admission Control and Embedding.",https://doi.org/10.1109/JSAC.2018.2815318,2018,A,IEEE Journal of Selected Areas in Communications (JSAC)
Reliability-Aware Service Chaining In Carrier-Grade Softwarized Networks.,https://doi.org/10.1109/JSAC.2018.2815338,2018,A,IEEE Journal of Selected Areas in Communications (JSAC)
Distributed Optimization of Collaborative Regions in Large-Scale Inhomogeneous Fog Computing.,https://doi.org/10.1109/JSAC.2018.2815359,2018,A,IEEE Journal of Selected Areas in Communications (JSAC)
Task Offloading for Mobile Edge Computing in Software Defined Ultra-Dense Network.,https://doi.org/10.1109/JSAC.2018.2815360,2018,A,IEEE Journal of Selected Areas in Communications (JSAC)
QoE-SDN APP: A Rate-guided QoE-aware SDN-APP for HTTP Adaptive Video Streaming.,https://doi.org/10.1109/JSAC.2018.2815421,2018,A,IEEE Journal of Selected Areas in Communications (JSAC)
Optimal VNFs Placement in CDN Slicing Over Multi-Cloud Environment.,https://doi.org/10.1109/JSAC.2018.2815441,2018,A,IEEE Journal of Selected Areas in Communications (JSAC)
Privacy-Preserving DDoS Attack Detection Using Cross-Domain Traffic in Software Defined Networks.,https://doi.org/10.1109/JSAC.2018.2815442,2018,A,IEEE Journal of Selected Areas in Communications (JSAC)
Efficient and Secure Service-Oriented Authentication Supporting Network Slicing for 5G-Enabled IoT.,https://doi.org/10.1109/JSAC.2018.2815418,2018,A,IEEE Journal of Selected Areas in Communications (JSAC)
Energy Efficient Subchannel and Power Allocation for Software-defined Heterogeneous VLC and RF Networks.,https://doi.org/10.1109/JSAC.2018.2815478,2018,A,IEEE Journal of Selected Areas in Communications (JSAC)
"Guest Editorial Physical Layer Security for 5G Wireless Networks, Part I.",https://doi.org/10.1109/JSAC.2018.2832378,2018,A,IEEE Journal of Selected Areas in Communications (JSAC)
A Survey of Physical Layer Security Techniques for 5G Wireless Networks and Challenges Ahead.,https://doi.org/10.1109/JSAC.2018.2825560,2018,A,IEEE Journal of Selected Areas in Communications (JSAC)
Securing On-Body IoT Devices By Exploiting Creeping Wave Propagation.,https://doi.org/10.1109/JSAC.2018.2824939,2018,A,IEEE Journal of Selected Areas in Communications (JSAC)
The Secrecy Capacity of Gaussian MIMO Wiretap Channels Under Interference Constraints.,https://doi.org/10.1109/JSAC.2018.2824758,2018,A,IEEE Journal of Selected Areas in Communications (JSAC)
Secure Communication Over Finite State Multiple-Access Wiretap Channel With Delayed Feedback.,https://doi.org/10.1109/JSAC.2018.2824938,2018,A,IEEE Journal of Selected Areas in Communications (JSAC)
Fundamental Limits on a Class of Secure Asymmetric Multilevel Diversity Coding Systems.,https://doi.org/10.1109/JSAC.2018.2825838,2018,A,IEEE Journal of Selected Areas in Communications (JSAC)
An LDPC Code Based Physical Layer Message Authentication Scheme With Prefect Security.,https://doi.org/10.1109/JSAC.2018.2825079,2018,A,IEEE Journal of Selected Areas in Communications (JSAC)
Polar Coding for the Cognitive Interference Channel With Confidential Messages.,https://doi.org/10.1109/JSAC.2018.2825139,2018,A,IEEE Journal of Selected Areas in Communications (JSAC)
Robust Beamforming for Physical Layer Security in BDMA Massive MIMO.,https://doi.org/10.1109/JSAC.2018.2824259,2018,A,IEEE Journal of Selected Areas in Communications (JSAC)
Exploiting Inter-User Interference for Secure Massive Non-Orthogonal Multiple Access.,https://doi.org/10.1109/JSAC.2018.2825058,2018,A,IEEE Journal of Selected Areas in Communications (JSAC)
Secure Massive MIMO With the Artificial Noise-Aided Downlink Training.,https://doi.org/10.1109/JSAC.2018.2825140,2018,A,IEEE Journal of Selected Areas in Communications (JSAC)
Optimal Transmit Antenna Selection for Massive MIMO Wiretap Channels.,https://doi.org/10.1109/JSAC.2018.2825159,2018,A,IEEE Journal of Selected Areas in Communications (JSAC)
Physically Securing Energy-Based Massive MIMO MAC via Joint Alignment of Multi-User Constellations and Artificial Noise.,https://doi.org/10.1109/JSAC.2018.2825818,2018,A,IEEE Journal of Selected Areas in Communications (JSAC)
Constant Envelope Hybrid Precoding for Directional Millimeter-Wave Communications.,https://doi.org/10.1109/JSAC.2018.2825820,2018,A,IEEE Journal of Selected Areas in Communications (JSAC)
Multiple Antennas Secure Transmission Under Pilot Spoofing and Jamming Attack.,https://doi.org/10.1109/JSAC.2018.2825148,2018,A,IEEE Journal of Selected Areas in Communications (JSAC)
Mapping-Varied Spatial Modulation for Physical Layer Security: Transmission Strategy and Secrecy Rate.,https://doi.org/10.1109/JSAC.2018.2824598,2018,A,IEEE Journal of Selected Areas in Communications (JSAC)
Secure and Precise Wireless Transmission for Random-Subcarrier-Selection-Based Directional Modulation Transmit Antenna Array.,https://doi.org/10.1109/JSAC.2018.2824231,2018,A,IEEE Journal of Selected Areas in Communications (JSAC)
Optimization or Alignment: Secure Primary Transmission Assisted by Secondary Networks.,https://doi.org/10.1109/JSAC.2018.2824360,2018,A,IEEE Journal of Selected Areas in Communications (JSAC)
Artificial Noise Aided Secure Cognitive Beamforming for Cooperative MISO-NOMA Using SWIPT.,https://doi.org/10.1109/JSAC.2018.2824622,2018,A,IEEE Journal of Selected Areas in Communications (JSAC)
Robust Secure Beamforming for 5G Cellular Networks Coexisting With Satellite Networks.,https://doi.org/10.1109/JSAC.2018.2824760,2018,A,IEEE Journal of Selected Areas in Communications (JSAC)
Resource Management for Device-to-Device Communication: A Physical Layer Security Perspective.,https://doi.org/10.1109/JSAC.2018.2825484,2018,A,IEEE Journal of Selected Areas in Communications (JSAC)
Advances in Satellite Communications Part 2: Guest Editorial.,https://doi.org/10.1109/JSAC.2018.2848378,2018,A,IEEE Journal of Selected Areas in Communications (JSAC)
"Precoding, Scheduling, and Link Adaptation in Mobile Interactive Multibeam Satellite Systems.",https://doi.org/10.1109/JSAC.2018.2832778,2018,A,IEEE Journal of Selected Areas in Communications (JSAC)
Cooperative Multigroup Multicast Transmission in Integrated Terrestrial-Satellite Networks.,https://doi.org/10.1109/JSAC.2018.2832780,2018,A,IEEE Journal of Selected Areas in Communications (JSAC)
Two-Color Scheme for a Multi-Beam Satellite Return Link: Impact of Interference Coordination.,https://doi.org/10.1109/JSAC.2018.2832784,2018,A,IEEE Journal of Selected Areas in Communications (JSAC)
Joint Coding and Multicast Subgrouping Over Satellite-eMBMS Networks.,https://doi.org/10.1109/JSAC.2018.2832818,2018,A,IEEE Journal of Selected Areas in Communications (JSAC)
Joint Beamforming for Secure Communication in Cognitive Satellite Terrestrial Networks.,https://doi.org/10.1109/JSAC.2018.2832819,2018,A,IEEE Journal of Selected Areas in Communications (JSAC)
Multiobjective Reinforcement Learning for Cognitive Satellite Communications Using Deep Neural Network Ensembles.,https://doi.org/10.1109/JSAC.2018.2832820,2018,A,IEEE Journal of Selected Areas in Communications (JSAC)
