A Survey of Energy-Efficient Techniques for 5G Networks and Challenges Ahead.,https://doi.org/10.1109/JSAC.2016.2550338,2016,A,IEEE Journal of Selected Areas in Communications (JSAC)
Pricing-Based Distributed Energy-Efficient Beamforming for MISO Interference Channels.,https://doi.org/10.1109/JSAC.2016.2544602,2016,A,IEEE Journal of Selected Areas in Communications (JSAC)
Energy Efficiency Optimization in Licensed-Assisted Access.,https://doi.org/10.1109/JSAC.2016.2544605,2016,A,IEEE Journal of Selected Areas in Communications (JSAC)
Power-Delay Tradeoff With Predictive Scheduling in Integrated Cellular and Wi-Fi Networks.,https://doi.org/10.1109/JSAC.2016.2544639,2016,A,IEEE Journal of Selected Areas in Communications (JSAC)
Learning to Be Green: Robust Energy Efficiency Maximization in Dynamic MIMO-OFDM Systems.,https://doi.org/10.1109/JSAC.2016.2544600,2016,A,IEEE Journal of Selected Areas in Communications (JSAC)
Energy Efficiency Optimization of 5G Radio Frequency Chain Systems.,https://doi.org/10.1109/JSAC.2016.2544579,2016,A,IEEE Journal of Selected Areas in Communications (JSAC)
Energy-Efficient Power Control of Cognitive Femto Users for 5G Communications.,https://doi.org/10.1109/JSAC.2016.2544601,2016,A,IEEE Journal of Selected Areas in Communications (JSAC)
Energy Group Buying With Loading Sharing for Green Cellular Networks.,https://doi.org/10.1109/JSAC.2016.2544603,2016,A,IEEE Journal of Selected Areas in Communications (JSAC)
From Immune Cells to Self-Organizing Ultra-Dense Small Cell Networks.,https://doi.org/10.1109/JSAC.2016.2544638,2016,A,IEEE Journal of Selected Areas in Communications (JSAC)
Joint Design of Radio and Transport for Green Residential Access Networks.,https://doi.org/10.1109/JSAC.2016.2544599,2016,A,IEEE Journal of Selected Areas in Communications (JSAC)
"Energy-Efficient Cell Activation, User Association, and Spectrum Allocation in Heterogeneous Networks.",https://doi.org/10.1109/JSAC.2016.2544478,2016,A,IEEE Journal of Selected Areas in Communications (JSAC)
Deploying Dense Networks for Maximal Energy Efficiency: Small Cells Meet Massive MIMO.,https://doi.org/10.1109/JSAC.2016.2544498,2016,A,IEEE Journal of Selected Areas in Communications (JSAC)
Spectral and Energy Efficiency of Multipair Two-Way Full-Duplex Relay Systems With Massive MIMO.,https://doi.org/10.1109/JSAC.2016.2544458,2016,A,IEEE Journal of Selected Areas in Communications (JSAC)
Fundamental Tradeoffs on Energy-Aware D2D Communication Underlaying Cellular Networks: A Dynamic Graph Approach.,https://doi.org/10.1109/JSAC.2016.2544558,2016,A,IEEE Journal of Selected Areas in Communications (JSAC)
Energy Efficient Resource Allocation for Mixed RF/VLC Heterogeneous Wireless Networks.,https://doi.org/10.1109/JSAC.2016.2544618,2016,A,IEEE Journal of Selected Areas in Communications (JSAC)
Energy Efficient Visible Light Communications Relying on Amorphous Cells.,https://doi.org/10.1109/JSAC.2016.2544598,2016,A,IEEE Journal of Selected Areas in Communications (JSAC)
Energy Efficiency of Downlink Networks With Caching at Base Stations.,https://doi.org/10.1109/JSAC.2016.2549398,2016,A,IEEE Journal of Selected Areas in Communications (JSAC)
Assessing System-Level Energy Efficiency of mmWave-Based Wearable Networks.,https://doi.org/10.1109/JSAC.2016.2544539,2016,A,IEEE Journal of Selected Areas in Communications (JSAC)
Cooperative Non-orthogonal Multiple Access With Simultaneous Wireless Information and Power Transfer.,https://doi.org/10.1109/JSAC.2016.2549378,2016,A,IEEE Journal of Selected Areas in Communications (JSAC)
Energy Efficient Beamforming in MISO Heterogeneous Cellular Networks With Wireless Information and Power Transfer.,https://doi.org/10.1109/JSAC.2016.2544538,2016,A,IEEE Journal of Selected Areas in Communications (JSAC)
Wireless-Powered Cooperative Communications: Power-Splitting Relaying With Energy Accumulation.,https://doi.org/10.1109/JSAC.2016.2544559,2016,A,IEEE Journal of Selected Areas in Communications (JSAC)
Mixed-ADC Massive MIMO.,https://doi.org/10.1109/JSAC.2016.2544604,2016,A,IEEE Journal of Selected Areas in Communications (JSAC)
Energy-Efficient Hybrid Analog and Digital Precoding for MmWave MIMO Systems With Large Antenna Arrays.,https://doi.org/10.1109/JSAC.2016.2549418,2016,A,IEEE Journal of Selected Areas in Communications (JSAC)
Traffic-Aware Cloud RAN: A Key for Green 5G Networks.,https://doi.org/10.1109/JSAC.2016.2549438,2016,A,IEEE Journal of Selected Areas in Communications (JSAC)
Smoothed Lp-Minimization for Green Cloud-RAN With User Admission Control.,https://doi.org/10.1109/JSAC.2016.2544578,2016,A,IEEE Journal of Selected Areas in Communications (JSAC)
Energy Efficiency of Downlink Transmission Strategies for Cloud Radio Access Networks.,https://doi.org/10.1109/JSAC.2016.2544459,2016,A,IEEE Journal of Selected Areas in Communications (JSAC)
Guest Editorial Green Communications and Networking Series.,https://doi.org/10.1109/JSAC.2016.2551620,2016,A,IEEE Journal of Selected Areas in Communications (JSAC)
Optimal Cell Load and Throughput in Green Small Cell Networks With Generalized Cell Association.,https://doi.org/10.1109/JSAC.2016.2520218,2016,A,IEEE Journal of Selected Areas in Communications (JSAC)
Delay-Constrained Energy-Optimal Base Station Sleeping Control.,https://doi.org/10.1109/JSAC.2016.2520221,2016,A,IEEE Journal of Selected Areas in Communications (JSAC)
Group Paging-Based Energy Saving for Massive MTC Accesses in LTE and Beyond Networks.,https://doi.org/10.1109/JSAC.2016.2520222,2016,A,IEEE Journal of Selected Areas in Communications (JSAC)
Green 5G Heterogeneous Networks Through Dynamic Small-Cell Operation.,https://doi.org/10.1109/JSAC.2016.2520217,2016,A,IEEE Journal of Selected Areas in Communications (JSAC)
Energy-Aware Traffic Offloading for Green Heterogeneous Networks.,https://doi.org/10.1109/JSAC.2016.2520244,2016,A,IEEE Journal of Selected Areas in Communications (JSAC)
Energy-Efficient Virtual Base Station Formation in Optical-Access-Enabled Cloud-RAN.,https://doi.org/10.1109/JSAC.2016.2520247,2016,A,IEEE Journal of Selected Areas in Communications (JSAC)
Decentralized Renewable Energy Pricing and Allocation for Millimeter Wave Cellular Backhaul.,https://doi.org/10.1109/JSAC.2016.2520249,2016,A,IEEE Journal of Selected Areas in Communications (JSAC)
Energy-Minimized Multipath Video Transport to Mobile Devices in Heterogeneous Wireless Networks.,https://doi.org/10.1109/JSAC.2016.2551483,2016,A,IEEE Journal of Selected Areas in Communications (JSAC)
GreenInfra: Capacity of Large-Scale Hybrid Networks With Cost-Effective Infrastructure.,https://doi.org/10.1109/JSAC.2016.2551487,2016,A,IEEE Journal of Selected Areas in Communications (JSAC)
User-Centric Cross-Tier Base Station Clustering and Cooperation in Heterogeneous Networks: Rate Improvement and Energy Saving.,https://doi.org/10.1109/JSAC.2016.2551488,2016,A,IEEE Journal of Selected Areas in Communications (JSAC)
Cluster Content Caching: An Energy-Efficient Approach to Improve Quality of Service in Cloud Radio Access Networks.,https://doi.org/10.1109/JSAC.2016.2545384,2016,A,IEEE Journal of Selected Areas in Communications (JSAC)
Wireless Content Caching for Small Cell and D2D Networks.,https://doi.org/10.1109/JSAC.2016.2545413,2016,A,IEEE Journal of Selected Areas in Communications (JSAC)
Delay-Energy Tradeoff in Multicast Scheduling for Green Cellular Systems.,https://doi.org/10.1109/JSAC.2016.2551559,2016,A,IEEE Journal of Selected Areas in Communications (JSAC)
Semidynamic Green Resource Management in Downlink Heterogeneous Networks by Group Sparse Power Control.,https://doi.org/10.1109/JSAC.2016.2545478,2016,A,IEEE Journal of Selected Areas in Communications (JSAC)
Ultra Dense Small Cell Networks: Turning Density Into Energy Efficiency.,https://doi.org/10.1109/JSAC.2016.2545539,2016,A,IEEE Journal of Selected Areas in Communications (JSAC)
Study of Reconfiguration Cost and Energy Aware VNE Policies in Cycle-Stationary Traffic Scenarios.,https://doi.org/10.1109/JSAC.2016.2520179,2016,A,IEEE Journal of Selected Areas in Communications (JSAC)
Energy-Efficient Chance-Constrained Resource Allocation for Multicast Cognitive OFDM Network.,https://doi.org/10.1109/JSAC.2016.2520180,2016,A,IEEE Journal of Selected Areas in Communications (JSAC)
Maximizing Network Utility of Rechargeable Sensor Networks With Spatiotemporally Coupled Constraints.,https://doi.org/10.1109/JSAC.2016.2520181,2016,A,IEEE Journal of Selected Areas in Communications (JSAC)
Energy-Efficient Cognitive Transmission With Imperfect Spectrum Sensing.,https://doi.org/10.1109/JSAC.2016.2520166,2016,A,IEEE Journal of Selected Areas in Communications (JSAC)
Energy Efficiency Versus Performance in Cognitive Wireless Networks.,https://doi.org/10.1109/JSAC.2016.2520219,2016,A,IEEE Journal of Selected Areas in Communications (JSAC)
Dynamic Energy Management for Smart-Grid-Powered Coordinated Multipoint Systems.,https://doi.org/10.1109/JSAC.2016.2520220,2016,A,IEEE Journal of Selected Areas in Communications (JSAC)
Greener Data Exchange in the Cloud: A Coding-Based Optimization for Big Data Processing.,https://doi.org/10.1109/JSAC.2016.2520245,2016,A,IEEE Journal of Selected Areas in Communications (JSAC)
Optimal Web Page Download Scheduling Policies for Green Web Crawling.,https://doi.org/10.1109/JSAC.2016.2520246,2016,A,IEEE Journal of Selected Areas in Communications (JSAC)
Joint Chance-Constrained Predictive Resource Allocation for Energy-Efficient Video Streaming.,https://doi.org/10.1109/JSAC.2016.2545358,2016,A,IEEE Journal of Selected Areas in Communications (JSAC)
A Green and Robust Optimization Strategy for Energy Saving Against Traffic Uncertainty.,https://doi.org/10.1109/JSAC.2016.2545378,2016,A,IEEE Journal of Selected Areas in Communications (JSAC)
Energy-Constrained Distributed Learning and Classification by Exploiting Relative Relevance of Sensors' Data.,https://doi.org/10.1109/JSAC.2016.2545381,2016,A,IEEE Journal of Selected Areas in Communications (JSAC)
Energy Efficiency With Proportional Rate Fairness in Multirelay OFDM Networks.,https://doi.org/10.1109/JSAC.2016.2545479,2016,A,IEEE Journal of Selected Areas in Communications (JSAC)
Optimal Throughput for Two-Way Relaying: Energy Harvesting and Energy Co-Operation.,https://doi.org/10.1109/JSAC.2016.2551481,2016,A,IEEE Journal of Selected Areas in Communications (JSAC)
A Channel Assignment and Routing Algorithm for Energy Harvesting Multiradio Wireless Mesh Networks.,https://doi.org/10.1109/JSAC.2016.2520238,2016,A,IEEE Journal of Selected Areas in Communications (JSAC)
Stability Analysis of Slotted Aloha With Opportunistic RF Energy Harvesting.,https://doi.org/10.1109/JSAC.2016.2520248,2016,A,IEEE Journal of Selected Areas in Communications (JSAC)
A Framework for Designing Multihop Energy Harvesting Sensor Networks.,https://doi.org/10.1109/JSAC.2016.2551486,2016,A,IEEE Journal of Selected Areas in Communications (JSAC)
Achievable Secrecy Rates of an Energy Harvesting Device.,https://doi.org/10.1109/JSAC.2016.2545379,2016,A,IEEE Journal of Selected Areas in Communications (JSAC)
Self-Sustainable Communications With RF Energy Harvesting: Ginibre Point Process Modeling and Analysis.,https://doi.org/10.1109/JSAC.2016.2551538,2016,A,IEEE Journal of Selected Areas in Communications (JSAC)
Indoor 2.45 GHz Wi-Fi Energy Harvester With Bridgeless Converter.,https://doi.org/10.1109/JSAC.2016.2551578,2016,A,IEEE Journal of Selected Areas in Communications (JSAC)
Delay Constrained Energy Harvesting Networks with Limited Energy and Data Storage.,https://doi.org/10.1109/JSAC.2016.2545418,2016,A,IEEE Journal of Selected Areas in Communications (JSAC)
Optimal Energy-Bandwidth Allocation for Energy-Harvesting Networks in Multiuser Fading Channels.,https://doi.org/10.1109/JSAC.2016.2545438,2016,A,IEEE Journal of Selected Areas in Communications (JSAC)
Optimal Online Sensing Scheduling for Energy Harvesting Sensors With Infinite and Finite Batteries.,https://doi.org/10.1109/JSAC.2016.2551561,2016,A,IEEE Journal of Selected Areas in Communications (JSAC)
Green Distributed Storage Using Energy Harvesting Nodes.,https://doi.org/10.1109/JSAC.2016.2545538,2016,A,IEEE Journal of Selected Areas in Communications (JSAC)
Cooperative Diamond Channel With Energy Harvesting Nodes.,https://doi.org/10.1109/JSAC.2016.2545558,2016,A,IEEE Journal of Selected Areas in Communications (JSAC)
Optical Traffic Grooming-Based Data Center Networks: Node Architecture and Comparison.,https://doi.org/10.1109/JSAC.2016.2520214,2016,A,IEEE Journal of Selected Areas in Communications (JSAC)
Power Consumption Model of NDN-Based Multicore Software Router Based on Detailed Protocol Analysis.,https://doi.org/10.1109/JSAC.2016.2520278,2016,A,IEEE Journal of Selected Areas in Communications (JSAC)
"Design, Analysis, and Hardware Emulation of a Novel Energy Conservation Scheme for Sensor Enhanced FiWi Networks (ECO-SFiWi).",https://doi.org/10.1109/JSAC.2016.2545380,2016,A,IEEE Journal of Selected Areas in Communications (JSAC)
Mobile Coordinated Wireless Sensor Network: An Energy Efficient Scheme for Real-Time Transmissions.,https://doi.org/10.1109/JSAC.2016.2545383,2016,A,IEEE Journal of Selected Areas in Communications (JSAC)
Assessing the Potential for Saving Energy by Impersonating Idle Networked Devices.,https://doi.org/10.1109/JSAC.2016.2545414,2016,A,IEEE Journal of Selected Areas in Communications (JSAC)
JOKER: A Novel Opportunistic Routing Protocol.,https://doi.org/10.1109/JSAC.2016.2545439,2016,A,IEEE Journal of Selected Areas in Communications (JSAC)
Channel-Adaptive Random Access With Discontinuous Channel Measurements.,https://doi.org/10.1109/JSAC.2016.2551562,2016,A,IEEE Journal of Selected Areas in Communications (JSAC)
HDEER: A Distributed Routing Scheme for Energy-Efficient Networking.,https://doi.org/10.1109/JSAC.2016.2545498,2016,A,IEEE Journal of Selected Areas in Communications (JSAC)
Fog Computing May Help to Save Energy in Cloud Computing.,https://doi.org/10.1109/JSAC.2016.2545559,2016,A,IEEE Journal of Selected Areas in Communications (JSAC)
Green Wireless Power Transfer Networks.,https://doi.org/10.1109/JSAC.2016.2520178,2016,A,IEEE Journal of Selected Areas in Communications (JSAC)
Energy Efficient Mobile Cloud Computing Powered by Wireless Energy Transfer.,https://doi.org/10.1109/JSAC.2016.2545382,2016,A,IEEE Journal of Selected Areas in Communications (JSAC)
Exploiting Constructive Interference for Simultaneous Wireless Information and Power Transfer in Multiuser Downlink Systems.,https://doi.org/10.1109/JSAC.2016.2551618,2016,A,IEEE Journal of Selected Areas in Communications (JSAC)
Adaptively Directional Wireless Power Transfer for Large-Scale Sensor Networks.,https://doi.org/10.1109/JSAC.2016.2551619,2016,A,IEEE Journal of Selected Areas in Communications (JSAC)
"Measuring and Troubleshooting the Internet: Algorithms, Tools and Applications.",https://doi.org/10.1109/JSAC.2016.2559239,2016,A,IEEE Journal of Selected Areas in Communications (JSAC)
Selective Capping of Packet Payloads at Multi-Gb/s Rates.,https://doi.org/10.1109/JSAC.2016.2559198,2016,A,IEEE Journal of Selected Areas in Communications (JSAC)
Network Traffic Processing With PFQ.,https://doi.org/10.1109/JSAC.2016.2558998,2016,A,IEEE Journal of Selected Areas in Communications (JSAC)
"AMON: An Open Source Architecture for Online Monitoring, Statistical Analysis, and Forensics of Multi-Gigabit Streams.",https://doi.org/10.1109/JSAC.2016.2558958,2016,A,IEEE Journal of Selected Areas in Communications (JSAC)
HEAP: Reliable Assessment of BGP Hijacking Attacks.,https://doi.org/10.1109/JSAC.2016.2558978,2016,A,IEEE Journal of Selected Areas in Communications (JSAC)
Lost in Space: Improving Inference of IPv4 Address Space Utilization.,https://doi.org/10.1109/JSAC.2016.2559218,2016,A,IEEE Journal of Selected Areas in Communications (JSAC)
"A High-Performance, Scalable Infrastructure for Large-Scale Active DNS Measurements.",https://doi.org/10.1109/JSAC.2016.2558918,2016,A,IEEE Journal of Selected Areas in Communications (JSAC)
"Latency-Based Anycast Geolocation: Algorithms, Software, and Data Sets.",https://doi.org/10.1109/JSAC.2016.2558898,2016,A,IEEE Journal of Selected Areas in Communications (JSAC)
The Power of SDN to Improve the Estimation of the ISP Traffic Matrix Through the Flow Spread Concept.,https://doi.org/10.1109/JSAC.2016.2559178,2016,A,IEEE Journal of Selected Areas in Communications (JSAC)
IRate: Initial Video Bitrate Selection System for HTTP Streaming.,https://doi.org/10.1109/JSAC.2016.2559078,2016,A,IEEE Journal of Selected Areas in Communications (JSAC)
Guest Editorial Power Line Communications and Its Integration With the Networking Ecosystem.,https://doi.org/10.1109/JSAC.2016.2566198,2016,A,IEEE Journal of Selected Areas in Communications (JSAC)
State of the Art in Power Line Communications: From the Applications to the Medium.,https://doi.org/10.1109/JSAC.2016.2566018,2016,A,IEEE Journal of Selected Areas in Communications (JSAC)
Performance Evaluation of an Efficient and Reliable Multicast Power Line Communication System.,https://doi.org/10.1109/JSAC.2016.2566038,2016,A,IEEE Journal of Selected Areas in Communications (JSAC)
Network Coding in the Link Layer for Reliable Narrowband Powerline Communications.,https://doi.org/10.1109/JSAC.2016.2566058,2016,A,IEEE Journal of Selected Areas in Communications (JSAC)
Analysis and Enhancement of CSMA/CA With Deferral in Power-Line Communications.,https://doi.org/10.1109/JSAC.2016.2566078,2016,A,IEEE Journal of Selected Areas in Communications (JSAC)
"PLC-to-DSL Interference: Statistical Model and Impact on VDSL2, Vectoring, and G.Fast.",https://doi.org/10.1109/JSAC.2016.2566118,2016,A,IEEE Journal of Selected Areas in Communications (JSAC)
Multiuser Communication Through Power Talk in DC MicroGrids.,https://doi.org/10.1109/JSAC.2016.2566138,2016,A,IEEE Journal of Selected Areas in Communications (JSAC)
Spectrally Efficient CSI Acquisition for Power Line Communications: A Bayesian Compressive Sensing Perspective.,https://doi.org/10.1109/JSAC.2016.2566140,2016,A,IEEE Journal of Selected Areas in Communications (JSAC)
A Statistical Model of the In-Home MIMO PLC Channel Based on European Field Measurements.,https://doi.org/10.1109/JSAC.2016.2566158,2016,A,IEEE Journal of Selected Areas in Communications (JSAC)
An MTL-Based Channel Model for Indoor Broadband MIMO Power Line Communications.,https://doi.org/10.1109/JSAC.2016.2566178,2016,A,IEEE Journal of Selected Areas in Communications (JSAC)
Guest Editorial Video Distribution Over Future Internet.,https://doi.org/10.1109/JSAC.2016.2596998,2016,A,IEEE Journal of Selected Areas in Communications (JSAC)
Scalable Cache Management for ISP-Operated Content Delivery Services.,https://doi.org/10.1109/JSAC.2016.2577319,2016,A,IEEE Journal of Selected Areas in Communications (JSAC)
Enabling Secure and Efficient Video Delivery Through Encrypted In-Network Caching.,https://doi.org/10.1109/JSAC.2016.2577301,2016,A,IEEE Journal of Selected Areas in Communications (JSAC)
Take-Away TV: Recharging Work Commutes With Predictive Preloading of Catch-Up TV Content.,https://doi.org/10.1109/JSAC.2016.2577298,2016,A,IEEE Journal of Selected Areas in Communications (JSAC)
Proactive Content Caching for Mobile Video Utilizing Transportation Systems and Evaluation Through Field Experiments.,https://doi.org/10.1109/JSAC.2016.2577238,2016,A,IEEE Journal of Selected Areas in Communications (JSAC)
Pricing and Resource Allocation via Game Theory for a Small-Cell Video Caching System.,https://doi.org/10.1109/JSAC.2016.2577278,2016,A,IEEE Journal of Selected Areas in Communications (JSAC)
Investigating the Performance of Pull-Based Dynamic Adaptive Streaming in NDN.,https://doi.org/10.1109/JSAC.2016.2577365,2016,A,IEEE Journal of Selected Areas in Communications (JSAC)
Perceptual Quality of HTTP Adaptive Streaming Strategies: Cross-Experimental Analysis of Multi-Laboratory and Crowdsourced Subjective Studies.,https://doi.org/10.1109/JSAC.2016.2577361,2016,A,IEEE Journal of Selected Areas in Communications (JSAC)
Adaptive Video Streaming: Rate and Buffer on the Track of Minimum Rebuffering.,https://doi.org/10.1109/JSAC.2016.2577360,2016,A,IEEE Journal of Selected Areas in Communications (JSAC)
A Scalable User Fairness Model for Adaptive Video Streaming Over SDN-Assisted Future Networks.,https://doi.org/10.1109/JSAC.2016.2577318,2016,A,IEEE Journal of Selected Areas in Communications (JSAC)
SVC-Based Multi-User Streamloading for Wireless Networks.,https://doi.org/10.1109/JSAC.2016.2577218,2016,A,IEEE Journal of Selected Areas in Communications (JSAC)
MSPlayer: Multi-Source and Multi-Path Video Streaming.,https://doi.org/10.1109/JSAC.2016.2577322,2016,A,IEEE Journal of Selected Areas in Communications (JSAC)
Speeding Up Future Video Distribution via Channel-Aware Caching-Aided Coded Multicast.,https://doi.org/10.1109/JSAC.2016.2577198,2016,A,IEEE Journal of Selected Areas in Communications (JSAC)
Privacy-Aware Multipath Video Caching for Content-Centric Networks.,https://doi.org/10.1109/JSAC.2016.2577321,2016,A,IEEE Journal of Selected Areas in Communications (JSAC)
TCP-Oriented Raptor Coding for High-Frame-Rate Video Transmission Over Wireless Networks.,https://doi.org/10.1109/JSAC.2016.2577178,2016,A,IEEE Journal of Selected Areas in Communications (JSAC)
Spectrum Management for Proactive Video Caching in Information-Centric Cognitive Radio Networks.,https://doi.org/10.1109/JSAC.2016.2577320,2016,A,IEEE Journal of Selected Areas in Communications (JSAC)
WhiteFi Infostation: Engineering Vehicular Media Streaming With Geolocation Database.,https://doi.org/10.1109/JSAC.2016.2577219,2016,A,IEEE Journal of Selected Areas in Communications (JSAC)
"Joint Caching, Routing, and Channel Assignment for Collaborative Small-Cell Cellular Networks.",https://doi.org/10.1109/JSAC.2016.2577199,2016,A,IEEE Journal of Selected Areas in Communications (JSAC)
"Guest Editorial Channel Modeling, Coding and Signal Processing for Novel Physical Memory Devices and Systems.",https://doi.org/10.1109/JSAC.2016.2603713,2016,A,IEEE Journal of Selected Areas in Communications (JSAC)
Enabling Accurate and Practical Online Flash Channel Modeling for Modern MLC NAND Flash Memory.,https://doi.org/10.1109/JSAC.2016.2603608,2016,A,IEEE Journal of Selected Areas in Communications (JSAC)
On the Capacity of the Beta-Binomial Channel Model for Multi-Level Cell Flash Memories.,https://doi.org/10.1109/JSAC.2016.2603660,2016,A,IEEE Journal of Selected Areas in Communications (JSAC)
Flash Memories: ISPP Renewal Theory and Flash Design Tradeoffs.,https://doi.org/10.1109/JSAC.2016.2604058,2016,A,IEEE Journal of Selected Areas in Communications (JSAC)
Performance of Multilevel Flash Memories With Different Binary Labelings: A Multi-User Perspective.,https://doi.org/10.1109/JSAC.2016.2603658,2016,A,IEEE Journal of Selected Areas in Communications (JSAC)
Capacity of the MLC NAND Flash Channel.,https://doi.org/10.1109/JSAC.2016.2603722,2016,A,IEEE Journal of Selected Areas in Communications (JSAC)
Mitigation of Inter-Cell Interference in Flash Memory With Capacity-Approaching Variable-Length Constrained Sequence Codes.,https://doi.org/10.1109/JSAC.2016.2603663,2016,A,IEEE Journal of Selected Areas in Communications (JSAC)
d-Imbalance WOM Codes for Reduced Inter-Cell Interference in Multi-Level NVMs.,https://doi.org/10.1109/JSAC.2016.2603621,2016,A,IEEE Journal of Selected Areas in Communications (JSAC)
LDPC Decoding Mappings That Maximize Mutual Information.,https://doi.org/10.1109/JSAC.2016.2603708,2016,A,IEEE Journal of Selected Areas in Communications (JSAC)
A General Non-Binary LDPC Code Optimization Framework Suitable for Dense Flash Memory and Magnetic Storage.,https://doi.org/10.1109/JSAC.2016.2603719,2016,A,IEEE Journal of Selected Areas in Communications (JSAC)
Minimal Maximum-Level Programming - Combined Cell Mapping and Coding for Faster MLC Memory.,https://doi.org/10.1109/JSAC.2016.2603791,2016,A,IEEE Journal of Selected Areas in Communications (JSAC)
MCMC Methods for Drawing Random Samples From the Discrete-Grains Model of a Magnetic Medium.,https://doi.org/10.1109/JSAC.2016.2603619,2016,A,IEEE Journal of Selected Areas in Communications (JSAC)
Turbo Equalization for Two Dimensional Magnetic Recording Using Voronoi Model Averaged Statistics.,https://doi.org/10.1109/JSAC.2016.2604518,2016,A,IEEE Journal of Selected Areas in Communications (JSAC)
Bidirectional Decision Feedback Modified Viterbi Detection (BD-DFMV) for Shingled Bit-Patterned Magnetic Recording (BPMR) With 2D Sectors and Alternating Track Widths.,https://doi.org/10.1109/JSAC.2016.2603620,2016,A,IEEE Journal of Selected Areas in Communications (JSAC)
The Rotating-Target Algorithm for Jointly Detecting Asynchronous Tracks.,https://doi.org/10.1109/JSAC.2016.2603723,2016,A,IEEE Journal of Selected Areas in Communications (JSAC)
Locally Rewritable Codes for Resistive Memories.,https://doi.org/10.1109/JSAC.2016.2603683,2016,A,IEEE Journal of Selected Areas in Communications (JSAC)
Fast Decoding ECC for Future Memories.,https://doi.org/10.1109/JSAC.2016.2603698,2016,A,IEEE Journal of Selected Areas in Communications (JSAC)
Euclidean Geometry-Based Spatially Coupled LDPC Codes for Storage.,https://doi.org/10.1109/JSAC.2016.2603703,2016,A,IEEE Journal of Selected Areas in Communications (JSAC)
Minimum Pearson Distance Detection Using Mass-Centered Codewords in the Presence of Unknown Varying Offset.,https://doi.org/10.1109/JSAC.2016.2603618,2016,A,IEEE Journal of Selected Areas in Communications (JSAC)
Near Optimal Viterbi Algorithm for Storage Channels With Linear Regressive Noise.,https://doi.org/10.1109/JSAC.2016.2603718,2016,A,IEEE Journal of Selected Areas in Communications (JSAC)
