"Power Control for D2D Underlaid Cellular Networks: Modeling, Algorithms, and Analysis.",https://doi.org/10.1109/JSAC.2014.2369612,2015,A,IEEE Journal of Selected Areas in Communications (JSAC)
Dynamic Power Control for Delay-Aware Device-to-Device Communications.,https://doi.org/10.1109/JSAC.2014.2369614,2015,A,IEEE Journal of Selected Areas in Communications (JSAC)
Distributed Power Allocation for Cooperative Wireless Network Localization.,https://doi.org/10.1109/JSAC.2014.2369631,2015,A,IEEE Journal of Selected Areas in Communications (JSAC)
Joint Resource Allocation for Device-to-Device Communications Underlaying Uplink MIMO Cellular Networks.,https://doi.org/10.1109/JSAC.2014.2369615,2015,A,IEEE Journal of Selected Areas in Communications (JSAC)
Device-to-Device Discovery for Proximity-Based Service in LTE-Advanced System.,https://doi.org/10.1109/JSAC.2014.2369591,2015,A,IEEE Journal of Selected Areas in Communications (JSAC)
Analyzing Assisted Offloading of Cellular User Sessions onto D2D Links in Unlicensed Bands.,https://doi.org/10.1109/JSAC.2014.2369616,2015,A,IEEE Journal of Selected Areas in Communications (JSAC)
Connectivity of Cognitive Device-to-Device Communications Underlying Cellular Networks.,https://doi.org/10.1109/JSAC.2014.2369611,2015,A,IEEE Journal of Selected Areas in Communications (JSAC)
A Geometrical-Based Throughput Bound Analysis for Device-to-Device Communications in Cellular Networks.,https://doi.org/10.1109/JSAC.2014.2369592,2015,A,IEEE Journal of Selected Areas in Communications (JSAC)
Human Body Shadowing in Cellular Device-to-Device Communications: Channel Modeling Using the Shadowed κ-μ Fading Model.,https://doi.org/10.1109/JSAC.2014.2369613,2015,A,IEEE Journal of Selected Areas in Communications (JSAC)
Guest Editorial: Fundamental Approaches to Network Coding in Wireless Communication Systems.,https://doi.org/10.1109/JSAC.2015.2388880,2015,A,IEEE Journal of Selected Areas in Communications (JSAC)
Constant-Delay and Constant-Feedback Moving Window Network Coding for Wireless Multicast: Design and Asymptotic Analysis.,https://doi.org/10.1109/JSAC.2014.2384215,2015,A,IEEE Journal of Selected Areas in Communications (JSAC)
Resource-Allocation Frameworks for Network-Coded Layered Multimedia Multicast Services.,https://doi.org/10.1109/JSAC.2014.2384231,2015,A,IEEE Journal of Selected Areas in Communications (JSAC)
Understanding Practical Limitations of Network Coding for Assisted Proximate Communication.,https://doi.org/10.1109/JSAC.2014.2384232,2015,A,IEEE Journal of Selected Areas in Communications (JSAC)
Coded Schemes for Asymmetric Wireless Interfaces: Theory and Practice.,https://doi.org/10.1109/JSAC.2014.2384233,2015,A,IEEE Journal of Selected Areas in Communications (JSAC)
Dynamic Wireless Network Coding With Overhearing and Variable Channel Rates.,https://doi.org/10.1109/JSAC.2014.2384251,2015,A,IEEE Journal of Selected Areas in Communications (JSAC)
On Optimal Policies for Network-Coded Cooperation: Theory and Implementation.,https://doi.org/10.1109/JSAC.2014.2384291,2015,A,IEEE Journal of Selected Areas in Communications (JSAC)
Network Coding Based Information Spreading in Dynamic Networks With Correlated Data.,https://doi.org/10.1109/JSAC.2014.2384293,2015,A,IEEE Journal of Selected Areas in Communications (JSAC)
Critical Graphs in Index Coding.,https://doi.org/10.1109/JSAC.2014.2384294,2015,A,IEEE Journal of Selected Areas in Communications (JSAC)
On Simple Multiple Access Networks.,https://doi.org/10.1109/JSAC.2014.2384295,2015,A,IEEE Journal of Selected Areas in Communications (JSAC)
A Linear Network Coding Approach for Uplink Distributed MIMO Systems: Protocol and Outage Behavior.,https://doi.org/10.1109/JSAC.2014.2384296,2015,A,IEEE Journal of Selected Areas in Communications (JSAC)
Network-Coded Multiple Access II: Toward Real-Time Operation With Improved Performance.,https://doi.org/10.1109/JSAC.2014.2384297,2015,A,IEEE Journal of Selected Areas in Communications (JSAC)
Network Coded Multihop Wireless Communication Networks: Channel Estimation and Training Design.,https://doi.org/10.1109/JSAC.2014.2384298,2015,A,IEEE Journal of Selected Areas in Communications (JSAC)
Delay Optimization and Cross-Layer Design in Multihop Wireless Networks With Network Coding and Successive Interference Cancelation.,https://doi.org/10.1109/JSAC.2014.2384331,2015,A,IEEE Journal of Selected Areas in Communications (JSAC)
Asynchronous Physical-Layer Network Coding With Quasi-Cyclic Codes.,https://doi.org/10.1109/JSAC.2014.2384332,2015,A,IEEE Journal of Selected Areas in Communications (JSAC)
Space-Time Physical-Layer Network Coding.,https://doi.org/10.1109/JSAC.2014.2384351,2015,A,IEEE Journal of Selected Areas in Communications (JSAC)
Degrees of Freedom of MIMO Multiway Relay Channel With Clustered Pairwise Exchange.,https://doi.org/10.1109/JSAC.2014.2384352,2015,A,IEEE Journal of Selected Areas in Communications (JSAC)
Guest Editorial: Wireless Communications Powered by Energy Harvesting and Wireless Energy Transfer (Part I).,https://doi.org/10.1109/JSAC.2015.2406514,2015,A,IEEE Journal of Selected Areas in Communications (JSAC)
Energy Harvesting Wireless Communications: A Review of Recent Advances.,https://doi.org/10.1109/JSAC.2015.2391531,2015,A,IEEE Journal of Selected Areas in Communications (JSAC)
Iterative Dynamic Water-Filling for Fading Multiple-Access Channels With Energy Harvesting.,https://doi.org/10.1109/JSAC.2015.2391571,2015,A,IEEE Journal of Selected Areas in Communications (JSAC)
Optimization of Energy Harvesting MISO Communication System With Feedback.,https://doi.org/10.1109/JSAC.2015.2391591,2015,A,IEEE Journal of Selected Areas in Communications (JSAC)
Achievable Throughput Optimization in Energy Harvesting Cognitive Radio Systems.,https://doi.org/10.1109/JSAC.2015.2391712,2015,A,IEEE Journal of Selected Areas in Communications (JSAC)
Resource Allocation for Multiple Access Channel With Conferencing Links and Shared Renewable Energy Sources.,https://doi.org/10.1109/JSAC.2015.2391791,2015,A,IEEE Journal of Selected Areas in Communications (JSAC)
Discrete Rate Scheduling for Packets With Individual Deadlines in Energy Harvesting Systems.,https://doi.org/10.1109/JSAC.2015.2391491,2015,A,IEEE Journal of Selected Areas in Communications (JSAC)
Delay Optimal Scheduling for Energy Harvesting Based Communications.,https://doi.org/10.1109/JSAC.2015.2391972,2015,A,IEEE Journal of Selected Areas in Communications (JSAC)
Optimum Policies for an Energy Harvesting Transmitter Under Energy Storage Losses.,https://doi.org/10.1109/JSAC.2015.2391511,2015,A,IEEE Journal of Selected Areas in Communications (JSAC)
"Joint Allocation of Resource Blocks, Power, and Energy-Harvesting Relays in Cellular Networks.",https://doi.org/10.1109/JSAC.2015.2391916,2015,A,IEEE Journal of Selected Areas in Communications (JSAC)
Outage Minimization for a Fading Wireless Link With Energy Harvesting Transmitter and Receiver.,https://doi.org/10.1109/JSAC.2015.2391951,2015,A,IEEE Journal of Selected Areas in Communications (JSAC)
Optimal Scheduling of Collaborative Sensing in Energy Harvesting Sensor Networks.,https://doi.org/10.1109/JSAC.2015.2391971,2015,A,IEEE Journal of Selected Areas in Communications (JSAC)
Distortion Minimization in Multi-Sensor Estimation With Energy Harvesting.,https://doi.org/10.1109/JSAC.2015.2391691,2015,A,IEEE Journal of Selected Areas in Communications (JSAC)
Near Optimal Energy Control and Approximate Capacity of Energy Harvesting Communication.,https://doi.org/10.1109/JSAC.2015.2391611,2015,A,IEEE Journal of Selected Areas in Communications (JSAC)
Energy Harvesting Receivers: Packet Sampling and Decoding Policies.,https://doi.org/10.1109/JSAC.2015.2391834,2015,A,IEEE Journal of Selected Areas in Communications (JSAC)
On the Stability of Random Multiple Access With Stochastic Energy Harvesting.,https://doi.org/10.1109/JSAC.2015.2391731,2015,A,IEEE Journal of Selected Areas in Communications (JSAC)
Multi-Access Communications With Energy Harvesting: A Multi-Armed Bandit Model and the Optimality of the Myopic Policy.,https://doi.org/10.1109/JSAC.2015.2391852,2015,A,IEEE Journal of Selected Areas in Communications (JSAC)
A Methodology for Designing the Control of Energy Harvesting Sensor Nodes.,https://doi.org/10.1109/JSAC.2015.2391812,2015,A,IEEE Journal of Selected Areas in Communications (JSAC)
Guest Editorial Emerging Technologies.,https://doi.org/10.1109/JSAC.2015.2393711,2015,A,IEEE Journal of Selected Areas in Communications (JSAC)
Energy Consumption Comparison of Interactive Cloud-Based and Local Applications.,https://doi.org/10.1109/JSAC.2015.2393431,2015,A,IEEE Journal of Selected Areas in Communications (JSAC)
Energy-Efficiency Oriented Traffic Offloading in Wireless Networks: A Brief Survey and a Learning Approach for Heterogeneous Cellular Networks.,https://doi.org/10.1109/JSAC.2015.2393496,2015,A,IEEE Journal of Selected Areas in Communications (JSAC)
Characterizing Energy-Delay Tradeoff in Hyper-Cellular Networks With Base Station Sleeping Control.,https://doi.org/10.1109/JSAC.2015.2393494,2015,A,IEEE Journal of Selected Areas in Communications (JSAC)
Efficient Working and Shirking in Information Sharing Networks.,https://doi.org/10.1109/JSAC.2015.2393432,2015,A,IEEE Journal of Selected Areas in Communications (JSAC)
Communication Theoretic Data Analytics.,https://doi.org/10.1109/JSAC.2015.2393471,2015,A,IEEE Journal of Selected Areas in Communications (JSAC)
Defining the Stack for Service Delivery Models and Interoperability in the Internet of Things: A Practical Case With OpenIoT-VDK.,https://doi.org/10.1109/JSAC.2015.2393491,2015,A,IEEE Journal of Selected Areas in Communications (JSAC)
Toward a Lightweight Authentication and Authorization Framework for Smart Objects.,https://doi.org/10.1109/JSAC.2015.2393436,2015,A,IEEE Journal of Selected Areas in Communications (JSAC)
Innovation and Standardization: Oxymoron or Pleonasm?,https://doi.org/10.1109/JSAC.2015.2393473,2015,A,IEEE Journal of Selected Areas in Communications (JSAC)
Metacognitive Radio Engine Design and Standardization.,https://doi.org/10.1109/JSAC.2015.2393452,2015,A,IEEE Journal of Selected Areas in Communications (JSAC)
Enabling Spectrum Sharing via Spectrum Consumption Models.,https://doi.org/10.1109/JSAC.2015.2393451,2015,A,IEEE Journal of Selected Areas in Communications (JSAC)
Spatial Sensing and Cognitive Radio Communication in the Presence of a K-User Interference Primary Network.,https://doi.org/10.1109/JSAC.2014.2361073,2015,A,IEEE Journal of Selected Areas in Communications (JSAC)
Efficient Energy Detection Methods for Spectrum Sensing Under Non-Flat Spectral Characteristics.,https://doi.org/10.1109/JSAC.2014.2361074,2015,A,IEEE Journal of Selected Areas in Communications (JSAC)
Intelligent Cooperative Spectrum Sensing via Hierarchical Dirichlet Process in Cognitive Radio Networks.,https://doi.org/10.1109/JSAC.2014.2361075,2015,A,IEEE Journal of Selected Areas in Communications (JSAC)
Correlation-Based Spectrum Sensing With Oversampling in Cognitive Radio.,https://doi.org/10.1109/JSAC.2014.2361076,2015,A,IEEE Journal of Selected Areas in Communications (JSAC)
Analysis and Optimization of Random Sensing Order in Cognitive Radio Networks.,https://doi.org/10.1109/JSAC.2014.2361077,2015,A,IEEE Journal of Selected Areas in Communications (JSAC)
Full-Duplex Spectrum-Sensing and MAC-Protocol for Multichannel Nontime-Slotted Cognitive Radio Networks.,https://doi.org/10.1109/JSAC.2014.2361078,2015,A,IEEE Journal of Selected Areas in Communications (JSAC)
Beamforming Duality and Algorithms for Weighted Sum Rate Maximization in Cognitive Radio Networks.,https://doi.org/10.1109/JSAC.2014.2361079,2015,A,IEEE Journal of Selected Areas in Communications (JSAC)
Radio Resource Allocation for OFDM-Based Dynamic Spectrum Sharing: Duality Gap and Time Averaging.,https://doi.org/10.1109/JSAC.2014.2361080,2015,A,IEEE Journal of Selected Areas in Communications (JSAC)
Performance Analysis of Cognitive Relay Networks Over Nakagami-m Fading Channels.,https://doi.org/10.1109/JSAC.2014.2361081,2015,A,IEEE Journal of Selected Areas in Communications (JSAC)
Optimal Beamforming and Power Allocation for Cognitive Femto Base Stations Based on Soft Decision.,https://doi.org/10.1109/JSAC.2014.2361082,2015,A,IEEE Journal of Selected Areas in Communications (JSAC)
"Joint Antenna Beamforming, Multiuser Scheduling, and Power Allocation for Hierarchical Cellular Systems.",https://doi.org/10.1109/JSAC.2014.2361083,2015,A,IEEE Journal of Selected Areas in Communications (JSAC)
Dynamic Rate and Channel Selection in Cognitive Radio Systems.,https://doi.org/10.1109/JSAC.2014.2361084,2015,A,IEEE Journal of Selected Areas in Communications (JSAC)
"Joint Relay Scheduling, Channel Access, and Power Allocation for Green Cognitive Radio Communications.",https://doi.org/10.1109/JSAC.2014.2361085,2015,A,IEEE Journal of Selected Areas in Communications (JSAC)
Priority-Based Dynamic Spectrum Management in a Smart Grid Network Environment.,https://doi.org/10.1109/JSAC.2014.2361088,2015,A,IEEE Journal of Selected Areas in Communications (JSAC)
Aeronautical Central Cognitive Broadband Air-to-Ground Communications.,https://doi.org/10.1109/JSAC.2014.2361089,2015,A,IEEE Journal of Selected Areas in Communications (JSAC)
Toward Transparent Coexistence for Multihop Secondary Cognitive Radio Networks.,https://doi.org/10.1109/JSAC.2014.2361090,2015,A,IEEE Journal of Selected Areas in Communications (JSAC)
Joint Pricing and Load Balancing for Cognitive Spectrum Access: Non-Cooperation Versus Cooperation.,https://doi.org/10.1109/JSAC.2014.2361091,2015,A,IEEE Journal of Selected Areas in Communications (JSAC)
Bayesian Hierarchical Mechanism Design for Cognitive Radio Networks.,https://doi.org/10.1109/JSAC.2014.2361092,2015,A,IEEE Journal of Selected Areas in Communications (JSAC)
Price and Inventory Competition in Oligopoly TV White Space Markets.,https://doi.org/10.1109/JSAC.2014.2361093,2015,A,IEEE Journal of Selected Areas in Communications (JSAC)
"Guest Editorial: Recent Advances in Heterogeneous Cellular Networks, Part I.",https://doi.org/10.1109/JSAC.2015.2417018,2015,A,IEEE Journal of Selected Areas in Communications (JSAC)
Optimizing User Association and Spectrum Allocation in HetNets: A Utility Perspective.,https://doi.org/10.1109/JSAC.2015.2417011,2015,A,IEEE Journal of Selected Areas in Communications (JSAC)
Joint Downlink Base Station Association and Power Control for Max-Min Fairness: Computation and Complexity.,https://doi.org/10.1109/JSAC.2015.2416982,2015,A,IEEE Journal of Selected Areas in Communications (JSAC)
A Network-Assisted Approach for RAT Selection in Heterogeneous Cellular Networks.,https://doi.org/10.1109/JSAC.2015.2416987,2015,A,IEEE Journal of Selected Areas in Communications (JSAC)
Game Theoretic Max-logit Learning Approaches for Joint Base Station Selection and Resource Allocation in Heterogeneous Networks.,https://doi.org/10.1109/JSAC.2015.2416988,2015,A,IEEE Journal of Selected Areas in Communications (JSAC)
Resource Allocation and Inter-Cell Interference Management for Dual-Access Small Cells.,https://doi.org/10.1109/JSAC.2015.2416990,2015,A,IEEE Journal of Selected Areas in Communications (JSAC)
Silence is Gold: Strategic Interference Mitigation Using Tokens in Heterogeneous Small Cell Networks.,https://doi.org/10.1109/JSAC.2015.2417012,2015,A,IEEE Journal of Selected Areas in Communications (JSAC)
Distributed Interference Management Policies for Heterogeneous Small Cell Networks.,https://doi.org/10.1109/JSAC.2015.2417014,2015,A,IEEE Journal of Selected Areas in Communications (JSAC)
Distributed Coordination of Co-Channel Femtocells via Inter-Cell Signaling With Arbitrary Delay.,https://doi.org/10.1109/JSAC.2015.2416983,2015,A,IEEE Journal of Selected Areas in Communications (JSAC)
Contract-Based Interference Coordination in Heterogeneous Cloud Radio Access Networks.,https://doi.org/10.1109/JSAC.2015.2416985,2015,A,IEEE Journal of Selected Areas in Communications (JSAC)
Secrecy Transmit Beamforming for Heterogeneous Networks.,https://doi.org/10.1109/JSAC.2015.2416984,2015,A,IEEE Journal of Selected Areas in Communications (JSAC)
Massive-MIMO Meets HetNet: Interference Coordination Through Spatial Blanking.,https://doi.org/10.1109/JSAC.2015.2416986,2015,A,IEEE Journal of Selected Areas in Communications (JSAC)
Interference Management in 5G Reverse TDD HetNets With Wireless Backhaul: A Large System Analysis.,https://doi.org/10.1109/JSAC.2015.2416991,2015,A,IEEE Journal of Selected Areas in Communications (JSAC)
Dynamic TDD Support in Macrocell-Assisted Small Cell Architecture.,https://doi.org/10.1109/JSAC.2015.2417013,2015,A,IEEE Journal of Selected Areas in Communications (JSAC)
DAWN: Delay-Aware Wi-Fi Offloading and Network Selection.,https://doi.org/10.1109/JSAC.2015.2416989,2015,A,IEEE Journal of Selected Areas in Communications (JSAC)
"5G Multi-RAT LTE-WiFi Ultra-Dense Small Cells: Performance Dynamics, Architecture, and Trends.",https://doi.org/10.1109/JSAC.2015.2417016,2015,A,IEEE Journal of Selected Areas in Communications (JSAC)
The Capacity of Known Interference Channel.,https://doi.org/10.1109/JSAC.2015.2417015,2015,A,IEEE Journal of Selected Areas in Communications (JSAC)
Spatiotemporal Cooperation in Heterogeneous Cellular Networks.,https://doi.org/10.1109/JSAC.2015.2417017,2015,A,IEEE Journal of Selected Areas in Communications (JSAC)
Capacity and Stable Scheduling in Heterogeneous Wireless Networks.,https://doi.org/10.1109/JSAC.2015.2416971,2015,A,IEEE Journal of Selected Areas in Communications (JSAC)
"Guest Editorial Location-Awareness for Radios and Networks, Part I.",https://doi.org/10.1109/JSAC.2015.2433411,2015,A,IEEE Journal of Selected Areas in Communications (JSAC)
Mobile Node Localization via Pareto Optimization: Algorithm and Fundamental Performance Limitations.,https://doi.org/10.1109/JSAC.2015.2430151,2015,A,IEEE Journal of Selected Areas in Communications (JSAC)
Localization and Location Verification in Non-Homogeneous One-Dimensional Wireless Ad-Hoc Networks.,https://doi.org/10.1109/JSAC.2015.2430280,2015,A,IEEE Journal of Selected Areas in Communications (JSAC)
Distributed Localization of a RF Target in NLOS Environments.,https://doi.org/10.1109/JSAC.2015.2430152,2015,A,IEEE Journal of Selected Areas in Communications (JSAC)
Deep Sensing for Future Spectrum and Location Awareness 5G Communications.,https://doi.org/10.1109/JSAC.2015.2430279,2015,A,IEEE Journal of Selected Areas in Communications (JSAC)
Localization Packet Scheduling for Underwater Acoustic Sensor Networks.,https://doi.org/10.1109/JSAC.2015.2430251,2015,A,IEEE Journal of Selected Areas in Communications (JSAC)
Machine Learning for Wideband Localization.,https://doi.org/10.1109/JSAC.2015.2430191,2015,A,IEEE Journal of Selected Areas in Communications (JSAC)
Occupancy Estimation Using Only WiFi Power Measurements.,https://doi.org/10.1109/JSAC.2015.2430272,2015,A,IEEE Journal of Selected Areas in Communications (JSAC)
Potential Game for Energy-Efficient RSS-Based Positioning in Wireless Sensor Networks.,https://doi.org/10.1109/JSAC.2015.2430172,2015,A,IEEE Journal of Selected Areas in Communications (JSAC)
New Efficient Indoor Cooperative Localization Algorithm With Empirical Ranging Error Model.,https://doi.org/10.1109/JSAC.2015.2430273,2015,A,IEEE Journal of Selected Areas in Communications (JSAC)
Energy-Efficient Network Navigation Algorithms.,https://doi.org/10.1109/JSAC.2015.2430271,2015,A,IEEE Journal of Selected Areas in Communications (JSAC)
ZIL: An Energy-Efficient Indoor Localization System Using ZigBee Radio to Detect WiFi Fingerprints.,https://doi.org/10.1109/JSAC.2015.2430171,2015,A,IEEE Journal of Selected Areas in Communications (JSAC)
Magicol: Indoor Localization Using Pervasive Magnetic Field and Opportunistic WiFi Sensing.,https://doi.org/10.1109/JSAC.2015.2430274,2015,A,IEEE Journal of Selected Areas in Communications (JSAC)
Location-Based Secure Transmission for Wiretap Channels.,https://doi.org/10.1109/JSAC.2015.2430211,2015,A,IEEE Journal of Selected Areas in Communications (JSAC)
"Guest Editorial: Wireless Communications Powered by Energy Harvesting and Wireless Energy Transfer, Part II.",https://doi.org/10.1109/JSAC.2015.2406515,2015,A,IEEE Journal of Selected Areas in Communications (JSAC)
The Beauty of the Commons: Optimal Load Sharing by Base Station Hopping in Wireless Sensor Networks.,https://doi.org/10.1109/JSAC.2015.2391689,2015,A,IEEE Journal of Selected Areas in Communications (JSAC)
Energy Pattern Aided Simultaneous Wireless Information and Power Transfer.,https://doi.org/10.1109/JSAC.2015.2391551,2015,A,IEEE Journal of Selected Areas in Communications (JSAC)
Data-Driven Stochastic Models and Policies for Energy Harvesting Sensor Communications.,https://doi.org/10.1109/JSAC.2015.2391651,2015,A,IEEE Journal of Selected Areas in Communications (JSAC)
A Mobile Platform for Wireless Charging and Data Collection in Sensor Networks.,https://doi.org/10.1109/JSAC.2015.2391631,2015,A,IEEE Journal of Selected Areas in Communications (JSAC)
Spatial Throughput Maximization of Wireless Powered Communication Networks.,https://doi.org/10.1109/JSAC.2015.2391915,2015,A,IEEE Journal of Selected Areas in Communications (JSAC)
The Price of Self-Sustainability for Block Transmission Systems.,https://doi.org/10.1109/JSAC.2015.2391752,2015,A,IEEE Journal of Selected Areas in Communications (JSAC)
Joint Wireless Information and Energy Transfer With Reduced Feedback in MIMO Interference Channels.,https://doi.org/10.1109/JSAC.2015.2391684,2015,A,IEEE Journal of Selected Areas in Communications (JSAC)
Relay Selection for Simultaneous Information Transmission and Wireless Energy Transfer: A Tradeoff Perspective.,https://doi.org/10.1109/JSAC.2015.2391771,2015,A,IEEE Journal of Selected Areas in Communications (JSAC)
Wireless Information and Energy Transfer for Two-Hop Non-Regenerative MIMO-OFDM Relay Networks.,https://doi.org/10.1109/JSAC.2015.2391931,2015,A,IEEE Journal of Selected Areas in Communications (JSAC)
On the Design of a Solar-Panel Receiver for Optical Wireless Communications With Simultaneous Energy Harvesting.,https://doi.org/10.1109/JSAC.2015.2391811,2015,A,IEEE Journal of Selected Areas in Communications (JSAC)
Movers and Shakers: Kinetic Energy Harvesting for the Internet of Things.,https://doi.org/10.1109/JSAC.2015.2391690,2015,A,IEEE Journal of Selected Areas in Communications (JSAC)
Throughput Optimization for Massive MIMO Systems Powered by Wireless Energy Transfer.,https://doi.org/10.1109/JSAC.2015.2391835,2015,A,IEEE Journal of Selected Areas in Communications (JSAC)
Grid Power-Delay Tradeoff for Energy Harvesting Wireless Communication Systems With Finite Renewable Energy Storage.,https://doi.org/10.1109/JSAC.2015.2391836,2015,A,IEEE Journal of Selected Areas in Communications (JSAC)
Statistical Models for Harvested Power From Human Motion.,https://doi.org/10.1109/JSAC.2015.2391871,2015,A,IEEE Journal of Selected Areas in Communications (JSAC)
Optimal Relaying in a Slotted Aloha Wireless Network With Energy Harvesting Nodes.,https://doi.org/10.1109/JSAC.2015.2391891,2015,A,IEEE Journal of Selected Areas in Communications (JSAC)
On the Performance of Overlaid Wireless Sensor Transmission With RF Energy Harvesting.,https://doi.org/10.1109/JSAC.2015.2391892,2015,A,IEEE Journal of Selected Areas in Communications (JSAC)
Efficiently Operating Wireless Nodes Powered by Renewable Energy Sources.,https://doi.org/10.1109/JSAC.2015.2391711,2015,A,IEEE Journal of Selected Areas in Communications (JSAC)
An MDP Model for Censoring in Harvesting Sensors: Optimal and Approximated Solutions.,https://doi.org/10.1109/JSAC.2015.2391792,2015,A,IEEE Journal of Selected Areas in Communications (JSAC)
Guest Editorial: Optical Wireless Communications.,https://doi.org/10.1109/JSAC.2015.2444491,2015,A,IEEE Journal of Selected Areas in Communications (JSAC)
Emerging Optical Wireless Communications-Advances and Challenges.,https://doi.org/10.1109/JSAC.2015.2458511,2015,A,IEEE Journal of Selected Areas in Communications (JSAC)
High-Speed Integrated Visible Light Communication System: Device Constraints and Design Considerations.,https://doi.org/10.1109/JSAC.2015.2432551,2015,A,IEEE Journal of Selected Areas in Communications (JSAC)
Unlocking Spectral Efficiency in Intensity Modulation and Direct Detection Systems.,https://doi.org/10.1109/JSAC.2015.2432530,2015,A,IEEE Journal of Selected Areas in Communications (JSAC)
A Multi-CAP Visible-Light Communications System With 4.85-b/s/Hz Spectral Efficiency.,https://doi.org/10.1109/JSAC.2015.2433053,2015,A,IEEE Journal of Selected Areas in Communications (JSAC)
Indoor MIMO Visible Light Communications: Novel Angle Diversity Receivers for Mobile Users.,https://doi.org/10.1109/JSAC.2015.2432514,2015,A,IEEE Journal of Selected Areas in Communications (JSAC)
Vehicle Motion and Pixel Illumination Modeling for Image Sensor Based Visible Light Communication.,https://doi.org/10.1109/JSAC.2015.2432511,2015,A,IEEE Journal of Selected Areas in Communications (JSAC)
Physical-Layer Security for MISO Visible Light Communication Channels.,https://doi.org/10.1109/JSAC.2015.2432513,2015,A,IEEE Journal of Selected Areas in Communications (JSAC)
Wavelength-Multiplexed Polymer LEDs: Towards 55 Mb/s Organic Visible Light Communications.,https://doi.org/10.1109/JSAC.2015.2432491,2015,A,IEEE Journal of Selected Areas in Communications (JSAC)
On the Performance of Free-Space Optical Communication Systems Over Double Generalized Gamma Channel.,https://doi.org/10.1109/JSAC.2015.2432529,2015,A,IEEE Journal of Selected Areas in Communications (JSAC)
